,Song,Album Debut,Songwriter(s),Lead Vocal(s),Year,Lyrics
134,"""Maxwell's Silver Hammer""",Abbey Road,McCartney,McCartney,1969,"Joan was quizzical, studied pataphysical Science in the home Late nights all alone with a test tube Oh, oh, oh, oh Maxwell Edison, majoring in medicine Calls her on the phone ""Can I take you out to the pictures Joa, oa, oa, oan?"" But as she's getting ready to go A knock comes on the door Bang! Bang! Maxwell's silver hammer Came down upon her head Bang! Bang! Maxwell's silver hammer Made sure that she was dead Back in school again Maxwell plays the fool again Teacher gets annoyed Wishing to avoid and unpleasant Sce, e, e, ene She tells Max to stay when the class has gone away So he waits behind Writing fifty times ""I must not be So, o, o, o"" But when she turns her back on the boy He creeps up from behind Bang! Bang! Maxwell's silver hammer Came down upon her head Bang! Bang! Maxwell's silver hammer Made sure that she was dead P. C. Thirty-one said, ""We caught a dirty one"" Maxwell stands alone Painting testimonial pictures Oh, oh, oh, oh Rose and Valerie, screaming from the gallery Say he must go free (Maxwell must go free) The judge does not agree and he tells them So, o, o, o But as the words are leaving his lips A noise comes from behind Bang! Bang! Maxwell's silver hammer Came down upon his head Bang! Bang! Maxwell's silver hammer Made sure that he was dead Whoa, oh, oh, oh Silver hammer man"
135,"""Mean Mr. Mustard""",Abbey Road,Lennon,"Lennon
 (with McCartney)",1969,"Mean Mister Mustard sleeps in the park Shaves in the dark trying to save paper Sleeps in a hole in the road Saving up to buy some clothes Keeps a ten-bob note up his nose Such a mean old man Such a mean old man His sister Pam works in a shop She never stops, she's a go-getter Takes him out to look at the queen Only place that he's ever been Always shouts out something obscene Such a dirty old man Dirty old man"
136,"""Michelle""",Rubber Soul,Lennon-McCartney,McCartney,1965,"Michelle, ma belle These are words that go together well My Michelle Michelle, ma belle Sont les mots qui vont très bien ensemble Très bien ensemble I love you, I love you, I love you That's all I want to say Until I find a way I will say the only words I know that You'll understand Michelle, ma belle Sont les mots qui vont très bien ensemble Très bien ensemble I need to, I need to, I need to I need to make you see Oh, what you mean to me Until I do I'm hoping you will Know what I mean I love you I want you, I want you, I want you I think you know by now I'll get to you somehow Until I do I'm telling you so You'll understand Michelle, ma belle Sont les mots qui vont très bien ensemble Très bien ensemble And I will say the only words I know That you'll understand, my Michelle"
137,"""Misery""","UK: Please Please Me
 US: Introducing… The Beatles",Lennon-McCartney,Lennon and McCartney,1963,"The world is treating me bad... Misery I'm the kind of guy Who never used to cry The world is treating me bad... Misery! I've lost her now for sure I won't see her no more It's gonna be a drag... Misery! I'll remember all the little things we've done Can't she see she'll always be the only one, only one Send her back to me Cos everyone can see Without her I will be in misery I'll remember all the little things we've done She'll remember and she'll miss her only one, lonely one Send her back to me Cos everyone can see Without her I will be in misery (Oh oh oh) In misery (Ooh ee ooh ooh) My misery (La la la la la la)"
138,"""Mother Nature's Son""",The Beatles,McCartney,McCartney,1968,Born a poor young country boy Mother Nature's son All day long I'm sitting singing songs for everyone. Sit beside a mountain stream See her waters rise Listen to the pretty sound of music as she flies. Find me in my field of grass Mother Nature's son Swaying daises sing a lazy song beneath the sun. Mother Nature's son.
139,"""The Night Before""",Help!,McCartney,McCartney,1965,"We said our goodbyes, ah, the night before Love was in your eyes, ah, the night before Now today I find you have changed your mind Treat me like you did the night before Were you telling lies, ah, the night before? Was I so unwise, ah, the night before? When I held you near you were so sincere Treat me like you did the night before Last night is a night I will remember you by When I think of things we did it makes me want to cry We said our goodbye, ah, the night before Love was in your eyes, ah, the night before Now today I find you have changed your mind Treat me like you did the night before When I held you near you were so sincere Treat me like you did the night before Last night is a night I will remember you by When I think of things we did, it makes me want to cry Were you telling lies, ah, the night before? Was I so unwise, ah, the night before? When I held you near you were so sincere Treat me like you did the night before Like the night before"
140,"""No Reply""","UK: Beatles for Sale
 US: Beatles '65",Lennon-McCartney,"Lennon
 (with McCartney)",1964,"This happened once before When I came to your door No reply They said it wasn't you But I saw you peep through Your window I saw the light I saw the light I know that you saw me 'Cause I looked up to see Your face I tried to telephone They said you were not home That's a lie 'Cause I know where you've been And I saw you walk in Your door I nearly died I nearly died 'Cause you walked hand in hand With another man In my place If I were you, I'd realize that I Love you more than any other guy And I'll forgive the lies that I Heard before, when you gave me no reply I tried to telephone They said you were not home That's a lie 'Cause I know where you've been And I saw you walk in Your door I nearly died I nearly died 'Cause you walked hand in hand With another man In my place No reply No reply"
141,"""Norwegian Wood (This Bird Has Flown)""",Rubber Soul,Lennon-McCartney,Lennon,1965,"I once had a girl Or should I say she once had me She showed me her room Isn't it good Norwegian wood? She asked me to stay And she told me to sit anywhere So I looked around And I noticed there wasn't a chair I sat on a rug biding my time Drinking her wine We talked until two and then she said ""It's time for bed"" She told me she worked In the morning and started to laugh I told her I didn't And crawled off to sleep in the bath And when I awoke I was alone This bird had flown So I lit a fire Isn't it good Norwegian wood?"
142,"""Not a Second Time""","UK: With the Beatles
 US: Meet the Beatles!",Lennon,Lennon,1963,"You know you made me cry, I see no use in wond'ring why, I cried for you. And now, you've changed your mind, I see no reason to change mine, I cried, it's through, oh. Oh, you're giving me the same old line, I'm wond'ring why, You hurt me then, you're back again, No, no, not a second time."
144,"""Nowhere Man""","UK: Rubber Soul
 US: Yesterday and Today",Lennon-McCartney,"Lennon
 (with McCartney and Harrison)",1965,"He's a real nowhere man Sitting in his nowhere land Making all his nowhere plans for nobody Doesn't have a point of view Knows not where he's going to Isn't he a bit like you and me? Nowhere man please listen You don't know what you're missing Nowhere man, The world is at your command He's as blind as he can be Just sees what he wants to see Nowhere man, can you see me at all Nowhere man don't worry Take your time, don't hurry Leave it all till somebody else Lends you a hand Ah, la, la, la, la Doesn't have a point of view Knows not where he's going to Isn't he a bit like you and me? Nowhere man please listen You don't know what you're missing Nowhere man, The world is at your command Ah, la, la, la, la He's a real nowhere man Sitting in his nowhere land Making all his nowhere plans for nobody Making all his nowhere plans for nobody Making all his nowhere plans for nobody"
145,"""Ob-La-Di, Ob-La-Da""",The Beatles,McCartney,McCartney,1968,"Desmond has a barrow in the marketplace Molly is the singer in a band Desmond says to Molly, girl, I like your face And Molly says this as she takes him by the hand Ob la di, ob-la-da, life goes on, bra La-la, how the life goes on Ob-la di, ob-la-da, life goes on, bra La-la, how the life goes on Desmond takes a trolley to the jeweller's store Buys a twenty carat golden ring Takes it back to Molly waiting at the door And as he gives it to her she begins to sing Ob la di, ob-la-da, life goes on, bra La-la, how the life goes on Ob-la di, ob-la-da, life goes on, bra La-la, how the life goes on In a couple of years they have built A home sweet home With a couple of kids running in the yard Of Desmond and Molly Jones Happy ever after in the market place Desmond lets the children lend a hand Molly stays at home and does her pretty face And in the evening she still sings it with the band Ob la di, ob-la-da, life goes on, bra La-la, how the life goes on Ob-la di, ob-la-da, life goes on, bra La-la, how the life goes on In a couple of years they have built A home sweet home With a couple of kids running in the yard Of Desmond and Molly Jones Happy ever after in the market place Molly lets the children lend a hand Desmond stays at home and does his pretty face And in the evening she's a singer with the band Ob la di, ob-la-da, life goes on, bra La-la, how the life goes on Ob-la di, ob-la-da, life goes on, bra La-la, how the life goes on And if you want some fun, sing ob-la-di, bla-da"
146,"""Oh! Darling""",Abbey Road,McCartney,McCartney,1969,"Oh! Darling, please believe me I'll never do you no harm Believe me when I tell you I'll never do you no harm Oh! Darling, if you leave me I'll never make it alone Believe me when I beg you, ooh Don't ever leave me alone When you told me You didn't need me anymore Well you know I nearly broke down and cried When you told me You didn't need me anymore Well you know I nearly broke down and died Oh! Darling, if you leave me I'll never make it alone Believe me when I tell you I'll never do you no harm Believe me darling When you told me, ooh You didn't need me anymore Well you know I nearly broke down and cried When you told me You didn't need me anymore Well you know I nearly broke down and died Oh! Darling, please believe me I'll never let you down Oh, believe me darling Believe me when I tell you, ooh I'll never do you no harm"
148,"""One After 909""",Let It Be,Lennon,"Lennon
 (with McCartney)",1969,"My baby said she's trav'ling on the one after 909 I said move over honey I'm traveling on that line I said move over once, move over twice Come on baby don't be cold as ice. Said she's trav'ling on the one after 909. I begged her not to go and I begged her on my bended knees, You're only fooling around, you're fooling around with me. I said move over once, move over twice Come on baby don't be cold as ice. Said she's trav'ling on the one after 909. I got my bag, run to the station Railman says you've got the the wrong location I got my bag, run right home Then I find I've got the number wrong Well she said she's trav'ling on the one after 909 I said move over honey I'm traveling on that line I said move over once, move over twice Come on baby don't be cold as ice. Said she's trav'ling on the one after 909. I got my bag, run to the station Railman says you've got the the wrong location I got my bag, run right home Then I find I've got the number wrong Well she said she's trav'ling on the one after 909 I said move over honey I'm traveling on that line I said move over once, move over twice Come on baby don't be cold as ice. Said she's trav'ling on the one after 9-0, Said she's trav'ling on the one after 9-0, Said she's trav'ling on the one after 909."
149,"""One and One Is Two""",,McCartney,McCartney,1964,"One and one is two What am I to do Now that I'm in love with you? I'm hoping everyday I'm gonna hear you say ""You really make my wish come true"" Can you feel when I'm holding you near All the things that I do? So, my love, am I making it clear? One and one is two One and one is two What am I to do Now that I'm in love with you? Can't you see I've loved you from the start? Don't you love me too? I love you, but you're breaking my heart From wanting you. One and one is two What am I to do Now that I'm in love with you? If you say that you're gonna be mine Everything is alright All the world would look so fine If you'll be mine tonight One and one is two What am I to do Now that I'm in love with you?"
151,"""Paperback Writer""","UK: A Collection of Beatles Oldies
 US: Hey Jude",McCartney,McCartney,1966,"Paperback writer, paperback writer. Dear Sir or Madam, will you read my book? It took me years to write, will you take a look? It's based on a novel by a man named Lear, And I need a job, So I want to be a paperback writer, Paperback writer. It's a dirty story of a dirty man, And his clinging wife doesn't understand. His son is working for the Daily Mail It's a steady job, But he wants to be a paperback writer, Paperback writer. Paperback writer, paperback writer. It's a thousand pages, give or take a few. I'll be writing more in a week or two. I could make it longer if you like the style. I can change it 'round, And I want to be a paperback writer, Paperback writer. If you really like it you can have the rights. It could make a million for you overnight. If you must return it you can send it here, But I need a break, And I want to be a paperback writer, Paperback writer. Paperback writer, paperback writer. Paperback writer, paperback writer. Paperback writer, paperback writer. Paperback writer, paperback writer. Paperback writer..."
152,"""Penny Lane""",Magical Mystery Tour,McCartney,McCartney,1966,"Penny Lane there is a barber showing photographs Of every head he's had the pleasure to know And all the people that come and go Stop and say ""Hello"" On the corner is a banker with a motorcar, And little children laugh at him behind his back And the banker never wears a mac In the pouring rain, very strange Penny Lane is in my ears and in my eyes There beneath the blue suburban skies I sit, and meanwhile back In Penny Lane there is a fireman with an hourglass, And in his pocket is a portrait of the Queen He likes to keep his fire engine clean, It's a clean machine Penny Lane is in my ears and in my eyes A four of fish and finger pies In summer. Meanwhile back Behind the shelter in the middle of the roundabout The pretty nurse is selling poppies from a tray And though she feels as if she's in a play, She is anyway In Penny Lane the barber shaves another customer, We see the banker sitting waiting for a trim, And then the fireman rushes in From the pouring rain - very strange Penny Lane is in my ears and in my eyes There beneath the blue suburban skies I sit, and meanwhile back Penny Lane is in my ears and in my eyes There beneath the blue suburban skies Penny Lane!"
154,"""Please Please Me""","UK: Please Please Me
 US: The Early Beatles",Lennon,Lennon and McCartney,1962,"Last night I said these words to my girl I know you never even try, girl C'mon (C'mon), c'mon (C'mon), c'mon (C'mon), c'mon (C'mon) Please please me, whoa yeah, like I please you You don't need me to show the way, love Why do I always have to say ""love"" C'mon (C'mon), c'mon (C'mon), c'mon (C'mon), c'mon (C'mon) Please please me, whoa yeah, like I please you I don't wanna sound complaining But you know there's always rain in my heart (In my heart) I do all the pleasing with you, it's so hard to reason With you, whoah yeah, why do you make me blue Last night I said these words to my girl I know you never even try, girl C'mon (C'mon), c'mon (C'mon), c'mon (C'mon), c'mon (C'mon) Please please me, whoa yeah, like I please you (Me) Whoa yeah, like I please you (Me) Whoa yeah, like I please you"
155,"""Polythene Pam""",Abbey Road,Lennon,Lennon,1969,"Well, you should see Polythene Pam She's so good-looking but she looks like a man Well, you should see her in drag dressed in her polythene bag Yes, you should see Polythene Pam Yeah, yeah, yeah Get a dose of her in jackboots and kilt She's killer-diller when she's dressed to the hilt She's the kind of a girl that makes the ""News of the World"" Yes, you could say she was attractively built Yeah, yeah, yeah"
156,"""P.S. I Love You""","UK: Please Please Me
 US: The Early Beatles",Lennon-McCartney,McCartney,1962,"As I write this letter Send my love to you Remember that I'll always Be in love with you Treasure these few words till we're together Keep all my love forever P.S. I love you You, you, you I'll be coming home again to you, love And till the day I do, love P.S. I love you You, you, you As I write this letter Send my love to you Remember that I'll always Be in love with you Treasure these few words till we're together Keep all my love forever P.S. I love you You, you, you As I write this letter (Oh) Send my love to you (You know I want you to) Remember that I'll always (Yeah) Be in love with you I'll be coming home again to you, love And till the day I do, love P.S. I love you You, you, you You, you, you I love you"
157,"""Rain""","UK: Rarities
 US: Hey Jude",Lennon,Lennon,1966,"If the rain comes  They run and hide their heads They might as well be dead If the rain comes If the rain comes When the sun shines  They slip into the shade And sip their lemonade When the sun shines When the sun shines Rain, I don't mind Shine, the weather's fine I can show you  That when it starts to rain Everything's the same I can show you I can show you Rain, I don't mind Shine, the weather's fine Can you hear me That when it rains and shines It's just a state of mind Can you hear me Can you hear me"
158,"""Real Love""",Anthology 2,Lennon,Lennon,1980,"All my little plans and schemes Lost like some forgotten dreams Seems that all I really was doing Was waiting for you Just like little girls and boys Playing with their little toys Seems like all they really were doing Was waiting for love Don't need to be alone No need to be alone It's real love, it's real Yes, it's real love, it's real From this moment on I know Exactly where my life will go Seems that all I really was doing Was waiting for love Don't need to be afraid No need to be afraid It's real love, it's real Yes, it's real love, it's real Thought I'd been in love before But in my heart, I wanted more Seems like all I really was doing Was waiting for you Don't need to be alone Don't need to be alone It's real love, it's real It's real love, it's real Yes, it's real love, it's real It's real love, it's real Yes, it's real love, it's real It's real love, it's real Yes, it's real love, it's real It's real love, it's real"
159,"""Revolution""","UK: 1967-1970
 US: Hey Jude",Lennon,Lennon,1968,"You say you want a revolution Well, you know We all want to change the world You tell me that it's evolution Well, you know We all want to change the world But when you talk about destruction Don't you know that you can count me out Don't you know it's gonna be  All right, all right, all right You say you got a real solution Well, you know We'd all love to see the plan You ask me for a contribution Well, you know We're doing what we can But if you want money for people with minds that hate All I can tell is brother you have to wait Don't you know it's gonna be  All right, all right, all right You say you'll change the constitution Well, you know We all want to change your head You tell me it's the institution Well, you know You better free you mind instead But if you go carrying pictures of chairman Mao You ain't going to make it with anyone anyhow Don't you know it's gonna be  All right, all right, all right All right, all right, all right All right, all right, all right All right, all right"
160,"""Rocky Raccoon""",The Beatles,Lennon-McCartney,McCartney,1968,"Now somewhere in the Black Mountain Hills of Dakota There lived a young boy named Rocky Raccoon And one day his woman ran off with another guy Hit young Rocky in the eye Rocky didn't like that He said, ""I'm gonna get that boy"" So one day he walked into town Booked himself a room in the local saloon Rocky Raccoon checked into his room Only to find Gideon's Bible Rocky had come, equipped with a gun To shoot off the legs of his rival His rival it seems, had broken his dreams By stealing the girl of his fancy Her name was Magill, and she called herself Lil But everyone knew her as Nancy Now she and her man, who called himself Dan Were in the next room at the hoe down Rocky burst in, and grinning a grin He said, ""Danny boy, this is a showdown"" But Daniel was hot, he drew first and shot And Rocky collapsed in the corner Now the doctor came in, stinking of gin And proceeded to lie on the table He said, ""Rocky, you met your match"" And Rocky said, ""Doc, it's only a scratch And I'll be better, I'll be better, Doc, as soon as I am able"" Now Rocky Raccoon, he fell back in his room Only to find Gideon's Bible Gideon checked out, and he left it, no doubt To help with good Rocky's revival"
161,"""Run for Your Life""",Rubber Soul,Lennon-McCartney,Lennon,1965,"Well, I'd rather see you dead, little girl Than to be with another man You better keep your head, little girl Or you won't know where I am You better run for your life if you can, little girl Hide your head in the sand, little girl Catch you with another man That's the end'a little girl Well, you know that I'm a wicked guy And I was born with a jealous mind And I can't spend my whole life Trying just to make you toe the line You better run for your life if you can, little girl Hide your head in the sand, little girl Catch you with another man That's the end'a little girl Let this be a sermon I mean everything I've said Baby, I'm determined And I'd rather see you dead You better run for your life if you can, little girl Hide your head in the sand, little girl Catch you with another man That's the end'a little girl I'd rather see you dead, little girl Than to be with another man You better keep your head, little girl Or you won't know where I am You better run for your life if you can, little girl Hide your head in the sand, little girl Catch you with another man That's the end'a little girl Na, na, na Na, na, na Na, na, na Na, na, na"
163,"""Sexy Sadie""",The Beatles,Lennon,Lennon,1968,"Sexy Sadie, what have you done You made a fool of everyone You made a fool of everyone Sexy Sadie, ooh, what have you done Sexy Sadie, you broke the rules You laid it down for all to see You laid it down for all to see Sexy Sadie, ooh, you broke the rules One sunny day the world was waiting for a lover She came along and turned on everyone Sexy Sadie, the greatest of them all Sexy Sadie, how did you know The world was waiting just for you The world was waiting just for you Sexy Sadie, ooh, how did you know Sexy Sadie, you'll get yours yet However big you think you are However big you think you are Sexy Sadie, ooh, you'll get yours yet We gave her everything we owned just to sit at her table Just a smile would lighten everything Sexy Sadie, she's the latest and the greatest of them all She made a fool of everyone Sexy Sadie However big you think you are Sexy Sadie"
164,"""Sgt. Pepper's Lonely Hearts Club Band""",Sgt. Pepper's Lonely Hearts Club Band,McCartney,"McCartney
 (with Lennon, Harrison and Starr)",1967,We're Sergeant Pepper's Lonely Hearts Club Band We hope you have enjoyed the show Sergeant Pepper's Lonely Hearts Club Band We're sorry but it's time to go Sergeant Pepper's Lonely Sergeant Pepper's Lonely Sergeant Pepper's Lonely Sergeant Pepper's Lonely Sergeant Pepper's Lonely Hearts Club Band We'd like to thank you once again Sergeant Pepper's one and only Lonely Hearts Club Band It's getting very near the end Sergeant Pepper's Lonely Sergeant Pepper's Lonely Sergeant Pepper's Lonely Hearts Club Band
165,"""Sgt. Pepper's Lonely Hearts Club Band (Reprise)""",Sgt. Pepper's Lonely Hearts Club Band,McCartney,"McCartney
 Lennon
 Harrison
 Starr",1967,"1,2,3,4 Bye! We're Sgt. Pepper's Lonely Hearts Club Band We hope you have enjoyed the show Sgt. Pepper's Lonely Hearts Club Band We're sorry but it's time to go Sgt. Pepper's lonely, Sgt. Pepper's lonely Sgt. Pepper's lonely, Sgt. Pepper's lonely Sgt. Pepper's Lonely Hearts Club Band We'd like to thank you once again Sgt. Pepper's one and only Lonely Hearts Club Band It's getting very near the end Sgt. Pepper's lonely, Sgt. Pepper's lonely Sgt. Pepper's Lonely Hearts Club Band"
166,"""She Came in Through the Bathroom Window""",Abbey Road,McCartney,McCartney,1969,"She came in through the bathroom window Protected by a silver spoon But now she sucks her thumb and wanders By the banks of her own lagoon Didn't anybody tell her? Didn't anybody see? Sunday's on the phone to Monday Tuesday's on the phone to me She said she'd always been a dancer She worked at fifteen clubs a day And though she thought I knew the answer Well, I knew what I could not say And so I quit the police department And got myself a steady job And though she tried her best to help me She could steal but she could not rob Didn't anybody tell her? Didn't anybody see? Sunday's on the phone to Monday, Tuesday's on the phone to me Oh yeah"
