,Song,Album Debut,Songwriter(s),Lead Vocal(s),Year,Lyrics
200,"""With a Little Help from My Friends""",Sgt. Pepper's Lonely Hearts Club Band,Lennon-McCartney,"Starr
 (with Lennon and McCartney)",1967,"Billy Shears What would you think if I sang out of tune Would you stand up and walk out on me? Lend me your ears and I'll sing you a song And I'll try not to sing out of key Oh I get by with a little help from my friends Mm I get high with a little help from my friends Mm gonna try with a little help from my friends What do I do when my love is away? (Does it worry you to be alone?) How do I feel by the end of the day? (Are you sad because you're on your own?) No I get by with a little help from my friends Mm I get high with a little help from my friends Mm gonna try with a little help from my friends (Do you need anybody?) I need somebody to love (Could it be anybody?) I want somebody to love (Would you believe in a love at first sight?) Yes I'm certain that it happens all the time (What do you see when you turn out the light?) I can't tell you, but I know it's mine Oh I get by with a little help from my friends Mm I get high with a little help from my friends Oh I'm gonna try with a little help from my friends (Do you need anybody?) I just need someone to love (Could it be anybody?) I want somebody to love Oh I get by with a little help from my friends Mm gonna try with a little help from my friends Oh I get high with a little help from my friends Yes I get by with a little help from my friends With a little help from my friends"
202,"""Woman""",Let It Be film,McCartney,McCartney,1965,"For the other half of the sky Woman, I can hardly express, My mixed emotion at my thoughtlessness, After all I'm forever in your debt, And woman, I will try to express, My inner feelings and thankfulness, For showing me the meaning of success, Ooh, well, well, Ooh, well, well, Woman, I know you understand The little child inside the man, Please remember my life is in your hands, And, woman, hold me close to your heart, However distant don't keep us apart, After all it is written in the stars, Ooh, well, well, Ooh, well, well, Woman, please let me explain, I never meant to cause you sorrow or pain, So let me tell you again and again and again, I love you (yeah, yeah) now and forever, I love you (yeah, yeah) now and forever, I love you (yeah, yeah) now and forever, I love you (yeah, yeah)."
203,"""The Word""",Rubber Soul,Lennon-McCartney,"Lennon
 (with McCartney and Harrison)",1965,"Say the word and you'll be free Say the word and be like me Say the word I'm thinking of Have you heard the word is love? It's so fine, it's sunshine It's the word, love In the beginning I misunderstood But now I've got it, the word is good Spread the word and you'll be free Spread the word and be like me Spread the word I'm thinking of Have you heard the word is love? It's so fine, it's sunshine It's the word, love Every where I go I hear it said In the good and bad books that I have read Say the word and you'll be free Say the word and be like me Say the word I'm thinking of Have you heard the word is love? It's so fine, it's sunshine It's the word, love Now that I know what I feel must be right I'm here to show everybody the light Give the word a chance to say That the word is just the way It's the word I'm thinking of And the only word is love It's so fine, it's sunshine It's the word, love Say the word love Say the word love Say the word love Say the word love"
204,"""Yellow Submarine""",Revolver,Lennon-McCartney,Starr,1966,"In the town where I was born Lived a man who sailed to sea And he told us of his life In the land of submarines So we sailed up to the sun Till we found a sea of green And we lived beneath the waves In our yellow submarine We all live in a yellow submarine Yellow submarine, yellow submarine We all live in a yellow submarine Yellow submarine, yellow submarine And our friends are all aboard Many more of them live next door And the band begins to play We all live in a yellow submarine Yellow submarine, yellow submarine We all live in a yellow submarine Yellow submarine, yellow submarine (Full speed ahead Mr. Boatswain, full speed ahead Full speed ahead it is, Sergeant. Cut the cable, drop the cable Aye, Sir, aye Captain, captain) As we live a life of ease Every one of us has all we need Sky of blue and sea of green In our yellow submarine We all live in a yellow submarine Yellow submarine, yellow submarine We all live in a yellow submarine Yellow submarine, yellow submarine We all live in a yellow submarine Yellow submarine, yellow submarine"
205,"""Yer Blues""",The Beatles,Lennon,Lennon,1968,"Yes, I'm lonely Want to die Yes, I'm lonely Want to die If I ain't dead already Oh, girl, you know the reason why In the morning Want to die In the evening Want to die If I ain't dead already Oh, girl, you know the reason why My mother was of the sky My father was of the earth But I am of the universe And you know what it's worth I'm lonely Want to die If I ain't dead already Oh, girl, you know the reason why The eagle picks my eye The worm he licks my bone I feel so suicidal Just like Dylan's Mr. Jones Lonely Want to die If I ain't dead already Oh, girl, you know the reason why Black cloud crossed my mind Blue mist round my soul Feel so suicidal Even hate my rock and roll Want to die Yeah, want to die If I ain't dead already Oh, girl, you know the reason why"
206,"""Yes It Is""","UK: Rarities
 US: Beatles VI",Lennon,"Lennon, McCartney and Harrison",1965,"If you wear red tonight Remember what I said tonight For red is the color that my baby wore And what is more, it's true Yes it is Scarlet were the clothes she wore Everybody knows I'm sure I would remember all the things we planned Understand, it's true Yes it is, it's true Yes it is I could be happy with you by my side If I could forget her, but it's my pride Yes it is, yes it is Oh, yes it is, yeah Please don't wear red tonight This is what I said tonight For red is the color that will make me blue In spite of you, it's true Yes it is, it's true Yes it is I could be happy with you by my side If I could forget her, but it's my pride Yes it is, yes it is Oh, yes it is, yeah Please don't wear red tonight This is what I said tonight For red is the color that will make me blue In spite of you, it's true Yes it is, it's true Yes it is, it's true"
207,"""Yesterday""","UK: Help!
 US: Yesterday and Today",McCartney,McCartney,1965,"Yesterday all my troubles seemed so far away. Now it looks as though they're here to stay. Oh, I believe in yesterday. Suddenly, I'm not half the man I used to be. There's a shadow hanging over me. Oh, yesterday came suddenly. Why she had to go? I don't know, she wouldn't say. I said something wrong. Now I long for yesterday. Yesterday love was such an easy game to play. Now I need a place to hide away. Oh, I believe in yesterday. Why she had to go? I don't know, she wouldn't say. I said something wrong. Now I long for yesterday. Yesterday love was such an easy game to play. Now I need a place to hide away. Oh, I believe in yesterday. Mm mm mm mm mm mm mm."
208,"""You Can't Do That""","UK: A Hard Day's Night
 US: The Beatles Second Album",Lennon,Lennon,1964,"I got something to say that might cause you pain, If I catch you talking to that boy again, I'm gonna let you down, And leave you flat, Because I told you before, oh, You can't do that. Well, it's the second time, I've caught you talking to him, Do I have to tell you one more time, I think it's a sin, I think I'll let you down. Let you down and leave you flat, Gonna let you down and leave you flat, Because I've told you before, oh, You can't do that. Everybody's green, 'Cause I'm the one, who won your love, But if they'd seen, You're talking that way they'd laugh in my face. So please listen to me, if you wanna stay mine, I can't help my feelings, I'll go out of my mind. I'm gonna let you down, And leave you flat, Gonna let you down and leave you flat, Because I've told you before, oh, You can't do that. You can't do that. You can't do that. You can't do that. You can't do that. You can't do that. Everybody's green, 'Cause I'm the one, who won your love, But if they'd seen, You're talking that way they'd laugh in my face. So please listen to me, if you wanna stay mine, I can't help my feelings, I'll go out of my mind. I'm gonna let you down, And leave you flat, Gonna let you down and leave you flat, Because I've told you before, oh, You can't do that."
209,"""You Know My Name (Look Up the Number)""","UK: Rarities
 US: Rarities",Lennon-McCartney,"Lennon
 McCartney",1967,"You know my name Look up the number You know my name Look up the number You, you know, you know my name You, you know, you know my name Good evening and welcome to Slaggers Featuring Denis O'Bell Come on Ringo, let's hear it for Denis Good evening You know my name Look, look, look up the number You know my name That's right, look up the number You, you know, you know my name You, you know, you know my name You know my name, ba ba ba ba ba ba ba ba ba Look up the number You know my name That's right, look up the number Oh, you know, you know, you know my name You know, you know, you know my name, huh huh huh huh You know my name, ba ba ba pum Look up the number You know my name Look up the number You, you know, you know my name, baby You, you know, you know my name You know, you know my name You know, you know my name, go on Denis Let's hear it for Denis O'Bell You know my name You know, you know my name You know, you know my name Prrr, you know my name and the number You know my name and the number  You know, you know my name, look up the number You know my number three, you know my number two You know my number three, you know my number four Oh, you know my name, you know number too You know my name, you know my number, what's up with you? You know my name, that's right?"
212,"""You Never Give Me Your Money""",Abbey Road,McCartney,McCartney,1969,"You never give me your money You only give me your funny paper And in the middle of negotiations You break down I never give you my number I only give you my situation And in the middle of investigation I break down Out of college, money spent See no future, pay no rent All the money's gone,  Any jobber got the sack Monday morning, turning back Yellow lorry slow, nowhere to go But oh, that magic feeling, nowhere to go Oh, that magic feeling Nowhere to go, nowhere to go One sweet dream Pick up the bags and get in the limousine Soon we'll be away from here Step on the gas and wipe that tear away One sweet dream came true today Came true today Came true today (yes, it did) One, two, three, four, five, six, seven All good children go to Heaven"
213,"""You Won't See Me""",Rubber Soul,McCartney,McCartney,1965,"When I call you up, your line's engaged I have had enough, so act your age We have lost the time that was so hard to find And I will lose my mind If you won't see me, you won't see me I don't know why you should want to hide But I can't get through, my hands are tied I won't want to stay, I don't have much to say But I get turned away And you won't see me, you won't see me Time after time you refuse to even listen I wouldn't mind if I knew what I was missing Though the days are few they're filled with tears And since I lost you, it feels like years Yes, it seems so long, girl, since you've been gone And I just can't go on If you won't see me, you won't see me Time after time you refuse to even listen I wouldn't mind if I knew what I was missing Though the days are few they're filled with tears And since I lost you, it feels like years Yes, it seems so long, girl, since you've been gone I just can't go on If you won't see me, you won't see me"
214,"""You'll Be Mine""",Anthology 1,Lennon-McCartney,McCartney,1960,"Well darling all the night You'll be mine and I know You'll be mine Till you die You'll be mine And so all the night You'll be mine You'll be mine And the stars Always shine You'll be mine Oh (My darling. When you burnt that toast the other morning I, I looked into you eyes and I could see that National Health eyeball and I loved you, like I never done, I have never done before!) Oh darling In your eyes And you'll be mine You will be mine You'll be mine At the star and so You'll be mine"
215,"""Your Mother Should Know""",Magical Mystery Tour,McCartney,McCartney,1967,"Let's all get up and dance to a song That was a hit before your mother was born Though she was born a long long time ago Your mother should know (your mother should) Your mother should know Sing it again Let's all get up and dance to a song That was a hit before your mother was born Though she was born a long long time ago Your mother should know (your mother should) Your mother should know Lift up your hearts and sing me a song That was a hit before your mother was born Though she was born a long long time ago Your mother should know (your mother should) Your mother should know Your mother should know (your mother should) Your mother should know Sing it again Da da dada da da da dada dada dada da da Da dada da da Though she was born a long long time ago Your mother should know (your mother should) Your mother should know Your mother should know (your mother should) Your mother should know Your mother should know (your mother should) Your mother should know, yeah"
216,"""You're Going to Lose That Girl""",Help!,Lennon,Lennon,1965,"You're going to lose that girl You're going to lose that girl If you don't take her out tonight She's going to change her mind And I will take her out tonight And I will treat her kind You're going to lose that girl You're going to lose that girl If you don't treat her right, my friend You're going to find her gone 'Cause I will treat her right, and then You'll be the lonely one You're going to lose that girl You're going to lose that girl You're going to lose I'll make a point of taking her away from you That's what you do, yeah The way you treat her what else can I do? You're going to lose that girl You're going to lose that girl You're going to lose that girl You're going to lose that girl You're going to lose I'll make a point of taking her away from you That's what you do, yeah The way you treat her what else can I do? If you don't take her out tonight She's going to change her mind And I will take her out tonight And I will treat her kind You're going to lose that girl You're going to lose that girl You're going to lose that girl"
217,"""You've Got to Hide Your Love Away""",Help!,Lennon,Lennon,1965,"Here I stand head in hand Turn my face to the wall If she's gone I can't go on Feeling two foot small Everywhere people stare Each and every day I can see them laugh at me And I hear them say Hey you've got to hide your love away Hey you've got to hide your love away How can I even try? I can never win Hearing them, seeing them In the state I'm in How could she say to me ""Love will find a way?"" Gather round all you clowns Let me hear you say Hey you've got to hide your love away Hey you've got to hide your love away"
218,The Lovely Linda,McCartney,McCartney,McCartney,1970,"La La La La La La, Lovely Linda, With The Lovely Flowers In Her Hair.  La La La La La La, Lovely Linda, With The Lovely Flowers In Her Hair.  Huh-Huh-Huh-Huh-Huh."
219,That Would Be something,McCartney,McCartney,McCartney,1970,"That would be something, It really would be something, That would be something, To meet you in the falling rain, momma, Meet you in the falling rain.  Oo-hmm-hmm, Oo-hmm-hmm, Oo-hmm-hmm, Meet you in the falling rain, momma, Meet you in the falling rain.  That would be something, It really would be something, Mm, that would be something, To meet you in the falling rain, momma, Meet you in the falling rain.  Meet you in the falling rain, momma, Meet you in the falling rain. Meet you in the falling rain, momma, Meet you in the falling rain.  That would be something, It really would be something, That would be something, To meet you in the falling rain, momma, Meet you in the falling rain. Meet you in the falling rain, momma, Meet you in the falling rain.  Oh, oh.  Meet you in the falling rain, momma, Meet you in the falling rain. Meet you in the falling rain, momma, Meet you in the falling rain.  Oh! Oh!  Uh, now, meet you in the falling rain, momma, Meet you in the falling rain. I meet you in the falling rain, momma, Meet you in the falling rain. Meet you in the falling rain, momma, Meet you in the falling rain. Uh, meet you in the falling rain, momma, Meet you in the falling rain."
220,Every Night,McCartney,McCartney,McCartney,1970,"Ev'ry night i just wanna go out, Get out of my head. Ev'ry day i don't wanna get up, Get out of my bed. Ev'ry night i want to play out And ev'ry day i wanna do-ooh-ooh-ooh-ooh. But tonight i just wanna stay in And be with you-oo, And be with you.  Ooh-ooh-ooh-ooh-ooh-ooh-ooh-ooh-ooh, Ooh-ooh-ooh-ooh. Ooh-ooh-ooh-ooh-ooh-ooh-ooh-ooh-ooh, Ooh-ooh-ooh-ooh.  Ev'ry day i lean on a lamp post, I'm wasting my time. Ev'ry night i lay on a pillow, I'm resting my mind. Ev'ry morning brings a new day And ev'ry night that day is throuough. But tonight i just wanna stay in And be with you, And be with you.  Ooh-ooh-ooh-ooh-ooh-ooh-ooh-ooh-ooh, Ooh-ooh-ooh-ooh, believe me, momma. Ooh-ooh-ooh-ooh-ooh-ooh-ooh-ooh-ooh, momma, Ooh-ooh-ooh-ooh.  Ooh-ooh-ooh-ooh........"
221,Junk ,McCartney,McCartney,McCartney,1970,"Motor cars, handle bars, Bicycles for two. Broken hearted jubilee.  Parachutes, army boots, Sleeping bags for two. Sentimental jamboree.  Buy! buy! Says the sign in the shop window. Why? why? Says the junk in the yard.  Da da ya da da da, Da da da, Da da ya da da, Da da da da da da da.  Candlesticks, building bricks, Something old and new. Memories for you and me.  Buy! buy! Says the sign in the shop window. Why? why? Says the junk in the yard."
222,Oo You,McCartney,McCartney,McCartney,1970,"Look like a woman, Dressed like a lady. Talk like a baby, ooh-ooh, Love like a woman, ooh-ooh-ooh-ooh.  Ooh-ooh, you, Ow! Ooh, you.  Walk like a woman, ooh-ooh, Sing like a blackbird, ah-ha. Eat like a hungry, ooh-ooh, Cook like a woman, ooh-ooh-ooh-ooh.  Ooh-ooh, woman, oh-oh-oh. Ow! Ooh-ooh-ooh-ooh-ooh-ooh, Ooh, you.  Look like a woman, Oo-oo-oo, dressed like a lady. Oo-oo-oo, talk like a baby, Golly, golly, golly, golly, go, go, ooh. Love like a woman, ooh-ooh-ooh-ooh. Ooh....."
223,Man We Was Lonely ,McCartney,McCartney,McCartney,1970,"Look like a woman, Dressed like a lady. Talk like a baby, ooh-ooh, Love like a woman, ooh-ooh-ooh-ooh.  Ooh-ooh, you, Ow! Ooh, you.  Walk like a woman, ooh-ooh, Sing like a blackbird, ah-ha. Eat like a hungry, ooh-ooh, Cook like a woman, ooh-ooh-ooh-ooh.  Ooh-ooh, woman, oh-oh-oh. Ow! Ooh-ooh-ooh-ooh-ooh-ooh, Ooh, you.  Look like a woman, Oo-oo-oo, dressed like a lady. Oo-oo-oo, talk like a baby, Golly, golly, golly, golly, go, go, ooh. Love like a woman, ooh-ooh-ooh-ooh. Ooh....."
224,Teddy Boy,McCartney,McCartney,McCartney,1970,"This is the story of a boy named ted, If his mother said, ""ted, be good."" He would.  She told him tales about his soldier dad, But it made her sad, then she'd cry. Oh my.  Ted used to tell her he'd be twice as good, And he knew he could, 'cause in his head, He said:  ""mommy don't worry, now teddy boy's here, Taking good care of you. Mommy don't worry, your teddy boy's here, Teddy's gonna see you through.""  Then came the day she found herself a man, Teddy turned and ran, far away, Ok  He couldn't stand to see his mother in love With another man, he didn't know. Oh no.  He found a place where he could settle down And from time to time, in his head, He said:  ""mommy don't worry, now teddy boy's here, Taking good care of you. Mommy don't worry, your teddy boy's here, Teddy's gonna see you through.""  She said:  ""teddy don't worry, now mummy is here, Taking good care of you. Teddy don't worry, your mummy is here, Mummy's gonna see you through.""  Ooh - Ah -ooh  This is the story of a boy named ted, If his mother said, ""ted, be good."" He would."
225,Maybe I'm Amazed,McCartney,McCartney,McCartney,1970,"Baby, I'm amazed at the way you love me all the time And maybe I'm afraid of the way I love you  Maybe I'm amazed at the way you pulled me out of time You hung me on the line Maybe I'm amazed at the way I really need you  Baby, I'm a man, maybe I'm a lonely man Who's in the middle of something That he doesn't really understand  Baby, I'm a man And maybe you're the only woman who could ever help me Baby, won't you help me to understand? Ooh-ooh-ooh-ooh-ooh-ooh  Oh yeah, yeah, yeah, yeah Oh, oh, oh Oh, oh, oh, oh Oh  Baby, I'm a man, maybe I'm a lonely man Who's in the middle of something That he doesn't really understand  Baby, I'm a man And maybe you're the only woman who could ever help me Baby, won't you help me to understand? Ooh-ooh-ooh-ooh-ooh-ooh  Maybe I'm amazed at the way you're with me all the time Maybe I'm afraid of the way I leave you  Maybe I'm amazed at the way you help me sing my song Right me when I'm wrong Maybe I'm amazed at the way I really need you"
226,Too Many People,Ram,McCartney,McCartney,1971,"Too many people going underground, Too many reaching for a piece of cake. Too many people pulled and pushed around, Too many waiting for that lucky break.  That was your first mistake, You took your lucky break and broke it in two. Now what can be done for you? You broke it in two.  Too many people sharing party lines, Too many people never sleeping late. Too many people paying parking fines, Too many hungry people losing weight.  That was your first mistake, You took your lucky break and broke it in two. Now what can be done for you? You broke it in two.  Mm-mm-uh-uh.  Uh!  Too many people preaching practices, Don't let 'em tell you what you wanna be. Too many people holding back, This is crazy, and baby, it's not like me.  That was your last mistake, I find my love awake and waiting to be. Now what can be done for you? She's waiting for me"
227,3 Legs,Ram,McCartney,McCartney,1971,"Well, when I walk, when I walk, Walk my horse upon a hill. Well, when I walk, walk, walk, walk, Walk my horse upon a hill. When I lay me down, Will my lover love me still?  A dog is here, A dog is there, My dog he got three legs But he can't run.  Well, when I thought, well, I thought, When I thought you was my friend. When I thought, well, I thought, When I thought you was my friend. But you let me down, ho, Put my heart around the bend.  A fly flies in, A fly flies out, Most flies they got three legs But mine got one.  Well, when I fly, when I fly, when I fly, When I fly above the clouds. Oh, when I fly, when I fly, when I fly, When I fly above the clouds. You can knock me down, with a feather, yes, you could, But you know it's not allowed.  A dog is here, A dog is there, My dog he got three legs But he can't run.  My dog he got three legs, your dog he got none, uh, uh, uh, My dog he got three legs, your dog he got none, My dog he got three legs, your dog he got none."
228,Ram On,Ram,McCartney,McCartney,1971,"Ram on, give your heart to somebody, Soon, right away, right away. Ram on, give your heart to somebody, Soon, right away, right away."
229,Dear Boy ,Ram,McCartney,McCartney,1971,"I guess you never knew, dear boy, what you have found, I guess you never knew, dear boy, That she was just the cutest thing around, I guess you never knew what you have found, Dear boy.  I guess you never knew, dear boy, That love was there. And maybe when you look to hard, dear boy, You never do become aware, I guess you never did become aware, Dear boy.  When i stepped in, my heart was down and out, But her love came through and brought me 'round, Got me up and about.  Dear boy, Dear boy, dear boy, Dear boy.  When i stepped in, my heart was down and out, But her love came through and brought me 'round, Got me up and about.  I hope you never know, dear boy, How much you missed. And even when you fall in love, dear boy, It won't be half as good as this. I hope you never know how much you missed, Dear boy, how much you missed"
230,Uncle Albert / Admiral Halsey,Ram,McCartney,McCartney,1971,"We're so sorry, uncle Albert, We're so sorry if we caused you any pain. We're so sorry, uncle Albert, But there's no one left at home And I believe I'm gonna rain.  We're so sorry, but we haven't heard a thing all day, We're so sorry, uncle Albert, But if anything should happen We'll be sure to give a ring.  ""We're so sorry, uncle Albert, But we haven't done a bloody thing all day. We're so sorry, uncle Albert, But the kettle's on the boil And we're so eas'ly called away.""  Uh-uh-uh-uh-uh-uh-uh-uh, Doo-uh-uh-uh-uh-uh-uh-uh-uh, Uh-uh -  Hands across the water, heads across the sky, Hands across the water, heads across the sky.  Admiral Halsey notified me, He had to have a berth or he couldn't get to sea. I had another look and I had a cup of tea and a butter pie.  ""Butter pie?"" ""The butter wouldn't melt, so I put it in the pie, alright!""  Hands across the water, heads across the sky, Hands across the water, heads across the sky.  Live a little, be a gypsy, get around, Get your feet up off the ground, Live a little, get around.  Live a little, be a gypsy, get around, Get your feet up off the ground, Live a little, get around.  Hands across the water, heads across the sky, Hands across the water, heads across the sky."
