,Song,Album Debut,Songwriter(s),Lead Vocal(s),Year,Lyrics
1,"""Across the Universe""",Let It Be,Lennon,Lennon,1968,"Words are flowing out like endless rain into a paper cup, They slither while they pass, they slip away across the universe. Pools of sorrow, waves of joy are drifting through my opened mind, Possessing and caressing me. Jai Guru Deva Om Nothing's gonna change my world, Nothing's gonna change my world. Nothing's gonna change my world, Nothing's gonna change my world. Images of broken light which dance before me like a million eyes, They call me on and on across the universe. Thoughts meander like a restless wind inside a letter box, They tumble blindly as they make their way across the universe. Jai Guru Deva Om Nothing's gonna change my world, Nothing's gonna change my world. Nothing's gonna change my world, Nothing's gonna change my world. Sounds of laughter, shades of earth are ringing Through my open ears inciting and inviting me. Limitless, undying love, which shines around me like a million suns, And calls me on and on across the universe. Jai Guru Deva Om Nothing's gonna change my world, Nothing's gonna change my world. Nothing's gonna change my world, Nothing's gonna change my world. Jai Guru Deva Jai Guru Deva Jai Guru Deva..."
2,"""All I've Got to Do""","UK: With the Beatles
 US: Meet the Beatles!",Lennon,Lennon,1963,"Whenever I want you around yeh  All I gotta do  Is call you on the phone  And you'll come running home  Yeh that's all I gotta do And when I, I want to kiss you yeh  All I gotta do  Is whisper in your ear  The words you want to hear  And I'll be kissing you And the same goes for me  Whenever you want me at all  I'll be here yes I will  Whenever you can  You just gotta call on me, yeh  You just gotta call on me And when I, I want to kiss you, yeh  All I got to do  Is call you on the phone  And you'll come running how  Yeh, that's all I gotta do And the same goes for me  Whenever you want me at all  I'll be here yes I will  Whenever you can  You just gotta call on me, yeh  You just gotta call on me  Oh, you just gotta call on me  Ooh, ooh"
3,"""All My Loving""","UK: With the Beatles
 US: Meet the Beatles!",McCartney,McCartney,1963,"Close your eyes and I'll kiss you Tomorrow I'll miss you Remember I'll always be true And then while I'm away I'll write home every day And I'll send all my loving to you I'll pretend that I'm kissing The lips I am missing And hope that my dreams will come true And then while I'm away I'll write home every day And I'll send all my loving to you All my loving, I will send to you All my loving, darling I'll be true Close your eyes and I'll kiss you Tomorrow I'll miss you Remember I'll always be true And then while I'm away I'll write home every day And I'll send all my loving to you All my loving, I will send to you All my loving, darling I'll be true All my loving, all my loving Woo, all my loving, I will send to you"
5,"""All Together Now""",Yellow Submarine,Lennon-McCartney,McCartney,1967,One two three four Can I have a little more Five six seven eight nine ten I love you A B C D Can I bring my friend to tea E F G H I J I love you Bom bom bom bompa bom Sail the ship Bompa bom Chop the tree bompa bom Skip the rope bompa bom Look at me All together now All together now All together now All together now All together now All together now All together now All together now Black white green red Can I take my friend to bed Pink brown yellow orange and blue I love you All together now All together now All together now All together now All together now All together now All together now All together now All together now All together now All together now All together now All together now All together now All together now All together now Bom bom bom bompa bom Sail the ship Bompa bom Chop the tree bompa bom Skip the rope bompa bom Look at me All together now All together now All together now All together now All together now All together now All together now All together now All together now All together now All together now All together now All together now All together now All together now All together now
6,"""All You Need Is Love""",Magical Mystery Tour,Lennon,Lennon,1967,"Love, love, love Love, love, love Love, love, love There's nothing you can do that can't be done Nothing you can sing that can't be sung Nothing you can say, but you can learn how to play the game It's easy Nothing you can make that can't be made No one you can save that can't be saved Nothing you can do, but you can learn how to be you in time It's easy All you need is love, all you need is love All you need is love, love, love is all you need All you need is love All you need is love, love, love is all you need There's nothing you can know that isn't known Nothing you can see that isn't shown There's nowhere you can be that isn't where you're meant to be It's easy All you need is love, all you need is love All you need is love, love, love is all you need All you need is love (All together now) All you need is love (Everybody) All you need is love, love, love is all you need Love is all you need Love is all you need Love is all you need Love is all you need Love is all you need Love is all you need Love is all you need Love is all you need Love is all you need Love is all you need Love is all you need Yesterday Oh yeah (She love you, yeah, yeah, yeah) (She love you, yeah, yeah, yeah)"
7,"""And I Love Her""","UK: A Hard Day's Night
 US: Something New",Lennon-McCartney,McCartney,1964,I give her all my love That's all I do And if you saw my love You'd love her too I love her She gives my everything And tenderly The kiss my lover brings She brings to me And I love her A love like ours Could never die As long as I Have you near me Bright are the stars that shine Dark is the sky I know this love of mine Will never die And I love her Bright are the stars that shine Dark is the sky I know this love of mine Will never die And I love her
8,"""And Your Bird Can Sing""","UK: Revolver
 US: Yesterday and Today",Lennon-McCartney,Lennon,1966,"You tell me that you've got everything you want And your bird can sing But you don't get me, you don't get me You say you've seen seven wonders and your bird is green But you can't see me, you can't see me When your prized possessions start to weigh you down Look in my direction, I'll be round, I'll be round When your bird is broken, will it bring you down? You may be awoken, I'll be round, I'll be round You tell me that you've heard every sound there is And your bird can swing But you can't hear me, you can't hear me"
9,"""Another Girl""",Help!,McCartney,McCartney,1965,"For I have got another girl, another girl You're making me say that I've got nobody but you But as from today well I've got somebody that's new I ain't no fool and I don't take what I don't want For I have got another girl, another girl She's sweeter than all the girls and I've met quite a few Nobody in all the world can do what she can do And so I'm telling you this time you'd better stop For I have got another girl Another girl who will love me till the end Through thick and thin she will always be my friend I don't want to say that I've been unhappy with you But as from today, well I've seen somebody that's new I ain't no fool and I don't take what I don't want For I have got another girl Another girl who will love me till the end Through thick and thin she will always be my friend For I have got another girl Another girl who will love me till the end Through thick and thin she will always be my friend For I have got another girl"
10,"""Any Time at All""","UK: A Hard Day's Night
 US: Something New",Lennon-McCartney,Lennon,1964,"Any time at all, any time at all, any time at all, all You've gotta do is call and I'll be there. If you need somebody to love, just look into my eyes, I'll Be there to make you feel right. If you're feeling sorry and sad, I'd really sympathize. Don't you be sad, just call me tonight. Any time at all, any time at all, any time at all , all You've gotta do is call and I'll be there. If the sun has faded away, I'll try to make it shine, There's nothing I won't do If you need a shoulder to cry on I hope it will be mine. Call me tonight, and I'll come to you. Any time at all, any time at all, any time at all , all You've gotta do is call and I'll be there. Any time at all, all you've gotta do is call and I'll be there."
11,"""Ask Me Why""","UK: Please Please Me
 US: The Early Beatles",Lennon-McCartney,Lennon,1963,"I love you, 'cause you tell me things I want to know. And it's true that it really only goes to show, That I know, That I, I, I, I should never, never, never be blue. Now you're mine, my happiness still makes me cry. And in time, you'll understand the reason why, If I cry, It's not because I'm sad, but you're the only love that I've ever had. I can't believe it's happened to me I can't conceive of any more misery. Ask me why, I'll say I love you, And I'm always thinking of you. I love you, 'cause you tell me things I want to know. And it's true that it really only goes to show, That I know, That I, I, I, I should never, never, never be blue. Ask me why, I'll say I love you, And I'm always thinking of you. I can't believe it's happened to me. I can't conceive of any more misery. Ask me why, I'll say I love you, And I'm always thinking of you."
12,"""Baby, You're a Rich Man""",Magical Mystery Tour,Lennon-McCartney,Lennon,1967,"How does it feel to be One of the beautiful people Now that you know who you are What do you want to be And have you traveled very far Far as the eye can see How does it feel to be One of the beautiful people How often have you been there Often enough to know What did you see when you were there Nothing that doesn't show Baby you're a rich man Baby you're a rich man Baby you're a rich man, too You keep all your money in a big brown bag Inside a zoo, what a thing to do Baby you're a rich man Baby you're a rich man Baby you're a rich man, too How does it feel to be One of the beautiful people Tuned to a natural E Happy to be that way Now that you've found another key What are you going to play Baby you're a rich man Baby you're a rich man Baby you're a rich man, too You keep all your money in a big brown bag Inside a zoo, what a thing to do Baby you're a rich man Baby you're a rich man Baby you're a rich man, too"
13,"""Baby's in Black""","UK: Beatles for Sale
 US: Beatles '65",Lennon-McCartney,"Lennon
 McCartney",1964,"Oh dear, what can I do? Baby's in black and I'm feeling blue Tell me, oh what can I do? She thinks of him And so she dresses in black And though he'll never come back She's dressed in black Oh dear, what can I do? Baby's in black and I'm feeling blue Tell me, oh what can I do? I think of her But she only thinks of him And though it's only a whim She thinks of him Oh how long will it take Till she sees the mistake she has made? Dear, what can I do? Baby's in black and I'm feeling blue Tell me, oh what can I do? Oh how long it will take Till she sees the mistake she has made? Dear, what can I do? Baby's in black and I'm feeling blue Tell me, oh what can I do? She thinks of him And so she dresses in black And though he'll never come back She's dressed in black Oh dear, what can I do? Baby's in black and I'm feeling blue Tell me, oh what can I do?"
14,"""Back in the U.S.S.R.",The Beatles,McCartney,McCartney,1968,"Flew in from Miami Beach BOAC Didn't get to bed last night On the way the paper bag was on my knee Man, I had a dreadful flight I'm back in the USSR You don't know how lucky you are, boy Back in the USSR, yeah Been away so long I early knew the place Gee, it's good to be back home Leave it till tomorrow to unpack my case Honey disconnect the phone I'm back in the USSR You don't know how lucky you are, boy Back in the US Back in the US Back in the USSR Well the Ukraine girls really knock me out They leave the west behind And Moscow girls make me sing and shout That Georgia's always on my my my my my my my my my mind Oh, come on Hu hey hu, hey, ah, yeah Yeah, yeah, yeah I'm back in the USSR You don't know how lucky you are, boys Back in the USSR Well the Ukraine girls really knock me out They leave the west behind And Moscow girls make me sing and shout That Georgia's always on my my my my my my my my my mind Oh, show me round your snow peaked Mountain way down south Take me to your daddy's farm Let me hear your balalaika's ringing out Come and keep your comrade warm I'm back in the USSR Hey, you don't know how lucky you are, boy Back in the USSR Oh, let me tell you honey"
15,"""Bad to Me""",The Beatles Bootleg Recordings 1963,Lennon,Lennon,1963,"If you ever leave me, I'll be sad and blue Don't you ever leave me, I'm so in love with you The birds in the sky would be sad and lonely If they knew that I'd lost my one and only They'd be sad if you're bad to me The leaves on the trees would be softly sighin' If they heard form the breeze that you left me cryin' They'd be sad, don't be bad to me But I know you won't leave me 'cause you told me so And I've no intention of letting you go Just as long as you let me know, you won't be bad to me So the birds in the sky won't be sad and lonely 'Cause they know that I got my one and only They'll be glad, you're not bad to me But I know you won't leave me 'cause you told me so And I've no intention of letting you go Just as long as you let me know, you won't be bad to me So the birds in the sky won't be sad and lonely 'Cause they know that I got my one and only They'll be glad, you're not bad to me They'll be glad, you're not bad to me, to me, to me"
16,"""The Ballad of John and Yoko""","UK: 1967–1970
 US: Hey Jude",Lennon,"Lennon
 (with McCartney)",1969,"Standing in the dock at Southampton Trying to get to Holland or France The man in the mac said You've got to go back You know they didn't even give us a chance Christ you know it ain't easy You know how hard it can be The way things are going They're going to crucify me Finally made the plane into Paris Honeymooning down by the Seine Peter Brown call to say You can make it O.K. You can get married in Gibraltar near Spain Christ you know it ain't easy You know how hard it can be The way things are going They're going to crucify me Drove from Paris to the Amsterdam Hilton Talking in our beds for a week The newspapers said Say what're you doing in bed I said we're only trying to get us some peace Christ you know it ain't easy You know how hard it can be The way things are going They're going to crucify me Saving up your money for a rainy day Giving all your clothes to charity Last night the wife said Oh boy when you're dead You don't take nothing with you but your soul, think Made a lightning trip to Vienna Eating chocolate cake in a bag The newspapers said She's gone to his head They look just like two gurus in drag Christ you know it ain't easy You know how hard it can be The way things are going They're going to crucify me Caught the early plane back to London Fifty acorns tied in a sack The men from the press Said we wish you success It's good to have the both of you back Christ you know it ain't easy You know how hard it can be The way things are going They're going to crucify me The way things are going They're going to crucify me"
17,"""Because""",Abbey Road,Lennon,"Lennon
 McCartney
 Harrison[26]",1969,"Because the world is round it turns me on Because the world is round, ah Because the wind is high it blows my mind Because the wind is high, ah Love is old, love is new Love is all, love is you Because the sky is blue, it makes me cry Because the sky is blue, ah Ah"
18,"""Because I Know You Love Me So""",Let It Be... Naked - Fly on the Wall bonus disc,Lennon-McCartney,"Lennon
 McCartney",1969,Wake up in the morning I don't feel blue 'Cause I know I got you Get a funny feeling all day and night I get the funny feeling you don't treat me right Should have read your letters And then I'd know I would have felt much better Because I know you love me so Wake up in the morning I don't feel blue 'Cause I know I got you Get a funny feeling all day and night I get the funny feeling you don't treat me right  Should have read your letters And then I'd know I would have felt much better Because I know you love me so
19,"""Being for the Benefit of Mr. Kite!""",Sgt. Pepper's Lonely Hearts Club Band,Lennon-McCartney,Lennon,1967,For the benefit of Mr. Kite There will be a show tonight on trampoline The Hendersons will all be there Late of Pablo Fanques Fair-what a scene Over men and horses hoops and garters Lastly through a hogshead of real fire! In this way Mr. K. will challenge the world! The celebrated Mr. K. Performs his feat on Saturday at Bishops Gate The Hendersons will dance and sing As Mr. Kite fly's through the ring don't be late Messrs. K and H. assure the public Their production will be second to none And of course Henry The Horse dances the waltz! The band begins at ten to six When Mr. K. performs his tricks without a sound And Mr. H. will demonstrate Ten summer sets he'll undertake on solid ground Having been some days in preparation A splendid time is guaranteed for all And tonight Mr. Kite is topping the bill
20,"""Birthday""",The Beatles,Lennon-McCartney,"McCartney
 (with Lennon)",1968,"They say it's your birthday It's my birthday too, yeah They say it's your birthday We're gonna have a good time I'm glad it's your birthday Happy birthday to you Ah Ah Ah Come on Come on Yes we're going to a party party Yes we're going to a party party Yes we're going to a party party I would like you to dance (Birthday) Take a cha-cha-cha-chance (Birthday) I would like you to dance (Birthday) Dance yeah Oh Come on I would like you to dance (Birthday) Take a cha-cha-cha-chance (Birthday) I would like you to dance (Birthday) Oh dance! Dance They say it's your birthday Well it's my birthday too, yeah They say it's your birthday We're gonna have a good time I'm glad it's your birthday Happy birthday to you"
21,"""Blackbird""",The Beatles,McCartney,McCartney,1968,"Blackbird singing in the dead of night Take these broken wings and learn to fly All your life You were only waiting for this moment to arise Blackbird singing in the dead of night Take these sunken eyes and learn to see All your life You were only waiting for this moment to be free Blackbird fly, blackbird fly Into the light of the dark black night Blackbird fly, blackbird fly Into the light of the dark black night Blackbird singing in the dead of night Take these broken wings and learn to fly All your life You were only waiting for this moment to arise You were only waiting for this moment to arise You were only waiting for this moment to arise"
23,"""Can't Buy Me Love""","UK: A Hard Day's Night
 US: Hey Jude",McCartney,"McCartney
 (with Lennon)",1964,"Can't buy me love, love Can't buy me love I'll buy you a diamond ring my friend if it makes you feel alright I'll get you anything my friend if it makes you feel alright Cos I don't care too much for money, and money can't buy me love I'll give you all I got to give if you say you'll love me too I may not have a lot to give but what I got I'll give to you I don't care too much for money, money can't buy me love Can't buy me love, everybody tells me so Can't buy me love, no no no, no Say you don't need no diamond ring and I'll be satisfied Tell me that you want the kind of thing that money just can't buy I don't care too much for money, money can't buy me love Owww Can't buy me love, everybody tells me so Can't buy me love, no no no, no Say you don't need no diamond ring and I'll be satisfied Tell me that you want the kind of thing that money just can't buy I don't care too much for money, money can't buy me love Can't buy me love, love Can't buy me love"
24,"""Carry That Weight""",Abbey Road,McCartney,"McCartney
 (with Lennon, Harrison, and Starr)[33]",1969,"Boy, you gotta carry that weight Carry that weight a long time Boy, you gonna carry that weight Carry that weight a long time I never give you my pillow I only send you my invitation And in the middle of the celebrations I break down Boy, you gotta carry that weight Carry that weight a long time Boy, you gotta carry that weight You're gonna carry that weight along time"
26,"""Child of Nature""",Let It Be... Naked - Fly on the Wall bonus disc,Lennon,Lennon,1968,"On the road to Rishikesh I was dreaming more or less And the dream I had was true Yes, the dream I had was true I'm just a child of nature I don't need much to set me free I'm just child of nature I'm one of nature's children Sunlight shining in your eyes As I face the desert skies And my thoughts return to home Yes, my thoughts return to home I'm just a child of nature I don't need much to set me free I'm just a child of nature I'm one nature's children Underneath the mountain ranges Where the wind that never changes Touch the windows of my soul Touch the windows of my soul I'm just a child of nature I don't need much to set me free I'm just a child of nature I'm one of nature's children"
29,"""Come and Get It""",Anthology 3,McCartney,McCartney,1969,"If you want it  Here it is,  Come and get it.  Make your mind up fast. If you want it  Anytime I can give it  But you better hurry  Cause it may not last. Did I hear you say  That there must be a catch  Will you walk away  From a fool and his money If you want it,  Here it is,  Come and get it,  But you better hurry  Cause it's going fast. If you want it  Here it is,  Come and get it,  Make your mind up fast. If you want it  Anytime I can give it,  But you'd better hurry  Cause it may not last. Did I hear you say  That there must be a catch  Will you walk away  From a fool and his money Sonny, if you want it,  Here it is,  Come and get it  But you'd better hurry  Cause it's going fast.  You'd better hurry  Cause it's going fast. Fool and his money. Sonny, if you want it,  Here it is,  Come and get it,  But you'd better hurry  Cause it's going fast,  You'd better hurry  Cause it's going fast,  You'd better hurry  Cause it's going fast."
30,"""Come Together""",Abbey Road,Lennon,Lennon,1969,"Here come old flat top He come grooving up slowly He got joo joo eyeball He one holy roller He got hair down to his knee Got to be a joker he just do what you please. He wear no shoe shine He got toe jam football He got monkey finger He shoot Coca-Cola He say I know you, you know me One thing I can tell you is you got to be free Come together right now over me He bag production He got walrus gumboot He got Ono sideboard He one spinal cracker He got feet down below his knee Hold you in his armchair you can feel his disease Come together right now over me Right! Come Come... Come... Come... He roller coaster He got early warning He got Muddy Water He one Mojo filter He say. ""One and one and one is three"" Got to be good looking 'cause he so hard to see Come together right now over me Oh! Come together Yeah Come together Yeah Come together Yeah Come together Yeah Come together Yeah Come together Yeah Come together Yeah Ahh Come together Yeah Come together..."
31,"""The Continuing Story of Bungalow Bill""",The Beatles,Lennon,Lennon,1968,"Hey, Bungalow Bill What did you kill Bungalow Bill? He went out tiger hunting with his elephant and gun In case of accidents he always took his mom He's the all American bullet-headed saxon mother's son. All the children sing Hey Bungalow Bill What did you kill Bungalow Bill? Deep in the jungle where the mighty tiger lies Bill and his elephants were taken by surprise So Captain Marvel zapped in right between the eyes All the children sing Hey, Bungalow Bill  What did you kill Bungalow Bill? The children asked him if to kill was not a sin Not when he looked so fierce, his mother butted in  If looks could kill it would have been us instead of him All the children sing Hey, Bungalow Bill What did you kill Bungalow Bill?"
32,"""Cry Baby Cry”",The Beatles,Lennon,"Lennon
 (with McCartney)",1968,Cry baby cry Make your mother sigh She's old enough to know better. The King of Marigold was in the kitchen Cooking breakfast for the Queen The Queen was in the parlor Playing piano for the children of the King. Cry baby cry Make your mother sigh She's old enough to know better. So cry baby cry. The King was in the garden Picking flowers for a friend who came to play The Queen was in the playroom Painting pictures for the children's holiday. Cry baby cry Make your mother sigh She's old enough to know better. So cry baby cry. The Dutchess of Kircaldy always smiling And arriving late for tea The Duke was having problems With a message at the local Bird and Bee. Cry baby cry Make your mother sigh She's old enough to know better. So cry baby cry. At twelve o'clock a meeting round the table For a seance in the dark With voices out of nowhere Put on specially by the children for a lark. Cry baby cry Make your mother sigh She's old enough to know better. So cry baby cry cry cry cry baby Make your mother sigh. She's old enough to know better Cry baby cry Cry cry cry Make your mother sigh She's old enough to know better. So cry baby cry.
